{
  "code": "Κ18",
  "title": {
    "el": "Υλοποίηση Συστημάτων Βάσεων Δεδομένων"
  },
  "category": "basic",
  "hours": {
    "theory": 3,
    "tutorial": 1,
    "lab": 0
  },
  "ects": 6,
  "semester": [
    5
  ],
  "prerequisites": [
    {
      "code": "Κ29",
      "type": "required"
    }
  ]
}
