{
  "code": "ΥΣ21",
  "title": {
    "el": "Σχολική Τάξη και Μικροδιδασκαλία"
  },
  "category": "elective",
  "hours": {
    "theory": 2,
    "tutorial": 0,
    "lab": 2
  },
  "ects": 6,
  "semester": [
    8
  ],
  "prerequisites": [
    {
      "code": "ΥΣ10",
      "type": "required"
    },
    {
      "code": "ΥΣ15",
      "type": "required"
    }
  ]
}
