{
  "code": "Κ20β",
  "title": {
    "el": "Συνεχή Μαθηματικά: Διανυσματικές Συναρτήσεις και Βελτιστοποίηση"
  },
  "category": "core",
  "hours": {
    "theory": 4,
    "tutorial": 2,
    "lab": 0
  },
  "ects": 7,
  "semester": [
    3
  ],
  "prerequisites": [
    {
      "code": "Κ01",
      "type": "required"
    },
    {
      "code": "Κ03",
      "type": "required"
    }
  ]
}
