{
  "code": "Κ31",
  "title": {
    "el": "Μεταγλωττιστές"
  },
  "category": "basic",
  "hours": {
    "theory": 4,
    "tutorial": 1,
    "lab": 0
  },
  "ects": 6,
  "semester": [
    6
  ],
  "prerequisites": [
    {
      "code": "Κ08",
      "type": "required"
    },
    {
      "code": "Κ10",
      "type": "required"
    },
    {
      "code": "Κ14",
      "type": "required"
    }
  ]
}
