{
  "code": "ΥΣ03",
  "title": {
    "el": "Σχεδίαση Ψηφιακών Συστημάτων VHDL"
  },
  "category": "basic",
  "hours": {
    "theory": 3,
    "tutorial": 0,
    "lab": 1
  },
  "ects": 6,
  "semester": [
    5
  ],
  "prerequisites": [
    {
      "code": "Κ02",
      "type": "required"
    },
    {
      "code": "Κ14",
      "type": "required"
    }
  ]
}
