{
  "code": "Κ17",
  "title": {
    "el": "Αλγόριθμοι και Πολυπλοκότητα"
  },
  "category": "core",
  "hours": {
    "theory": 4,
    "tutorial": 2,
    "lab": 0
  },
  "ects": 6,
  "semester": [
    4
  ],
  "prerequisites": [
    {
      "code": "Κ08",
      "type": "required"
    },
    {
      "code": "Κ09",
      "type": "required"
    }
  ]
}
