{
  "code": "ΥΣ08",
  "title": {
    "el": "Αλληλεπίδραση Ανθρώπου Υπολογιστή"
  },
  "category": "elective",
  "hours": {
    "theory": 3,
    "tutorial": 1,
    "lab": 1
  },
  "ects": 6,
  "semester": [
    5
  ],
  "prerequisites": [
    {
      "code": "Κ29",
      "type": "required"
    }
  ]
}
