{
  "code": "ΚΤΝ2",
  "title": {
    "el": "Μηχανική Μάθηση"
  },
  "category": "core",
  "hours": {
    "theory": 3,
    "tutorial": 1,
    "lab": 0
  },
  "ects": 6,
  "semester": [
    5
  ],
  "prerequisites": [
    {
      "code": "Κ13",
      "type": "required"
    },
    {
      "code": "Κ03",
      "type": "required"
    }
  ]
}
