{
  "code": "Κ08",
  "title": {
    "el": "Δομές Δεδομένων και Τεχνικές Προγραμματισμού"
  },
  "category": "core",
  "hours": {
    "theory": 3,
    "tutorial": 1,
    "lab": 1
  },
  "ects": 8,
  "semester": [
    2
  ],
  "prerequisites": [
    {
      "code": "Κ04",
      "type": "required"
    }
  ]
}
