{
  "code": "ΘΠ22",
  "title": {
    "el": "Αλγόριθμοι-Θεμελιώσεις Μηχανικής Μάθησης"
  },
  "category": "basic",
  "hours": {
    "theory": 4,
    "tutorial": 0,
    "lab": 0
  },
  "ects": 6,
  "semester": [
    6
  ],
  "prerequisites": [
    {
      "code": "ΚΤΝ1",
      "type": "required"
    },
    {
      "code": "Κ13",
      "type": "required"
    },
    {
      "code": "ΚΤΝ2",
      "type": "required"
    }
  ]
}
