{
  "code": "ΥΣ09",
  "title": {
    "el": "Τεχνολογία Λογισμικού"
  },
  "category": "elective",
  "hours": {
    "theory": 3,
    "tutorial": 1,
    "lab": 0
  },
  "ects": 6,
  "semester": [
    8
  ],
  "prerequisites": [
    {
      "code": "Κ10",
      "type": "required"
    },
    {
      "code": "ΥΣ04",
      "type": "required"
    }
  ]
}
