{
  "code": "ΘΠ01",
  "title": {
    "el": "Θεμελιώσεις Γλωσσών Προγραμματισμού"
  },
  "category": "elective",
  "hours": {
    "theory": 4,
    "tutorial": 0,
    "lab": 0
  },
  "ects": 6,
  "semester": [
    5
  ],
  "prerequisites": [
    {
      "code": "Κ08",
      "type": "required"
    }
  ]
}
