{
  "code": "ΕΠ04",
  "title": {
    "el": "Ψηφιακές Επικοινωνίες"
  },
  "category": "basic",
  "hours": {
    "theory": 3,
    "tutorial": 1,
    "lab": 0
  },
  "ects": 6,
  "semester": [
    6
  ],
  "prerequisites": [
    {
      "code": "Κ21",
      "type": "required"
    },
    {
      "code": "Κ20β",
      "type": "required"
    }
  ]
}
